"No.","Time","Source","Destination","Protocol","Length","Info"
"1","0.000000","10.0.1.2","10.0.1.1","ECHO","98","Request"
"2","0.000329","10.0.1.1","10.0.1.2","ECHO","98","Response"
"3","1.003267","10.0.1.2","10.0.1.1","ECHO","98","Request"
"4","1.003766","10.0.1.1","10.0.1.2","ECHO","98","Response"
"5","20.894153","Private_66:68:00","Broadcast","ARP","64","Who has 10.0.1.3? Tell 10.0.1.1 [ETHERNET FRAME CHECK SEQUENCE INCORRECT]"
"6","20.894939","Private_66:68:02","Private_66:68:00","ARP","64","10.0.1.3 is at 00:50:79:66:68:02 [ETHERNET FRAME CHECK SEQUENCE INCORRECT]"
"7","20.897030","10.0.1.1","10.0.1.3","ECHO","98","Request"
"8","20.899369","10.0.1.3","10.0.1.1","ECHO","98","Response"
"9","21.905705","10.0.1.1","10.0.1.3","ECHO","98","Request"
"10","21.910179","10.0.1.3","10.0.1.1","ECHO","98","Response"
"11","28.042600","10.0.1.1","10.0.1.2","TCP","74","31036  >  7 [SYN] Seq=0 Win=2920 Len=0 MSS=1460 TSval=1576231080 TSecr=0 WS=2"
"12","28.042956","10.0.1.2","10.0.1.1","TCP","54","7  >  31036 [SYN, ACK] Seq=0 Ack=1 Win=2920 Len=0"
"13","28.046629","10.0.1.1","10.0.1.2","TCP","66","31036  >  7 [ACK] Seq=1 Ack=1 Win=2920 Len=0 TSval=1576231080 TSecr=0"
"14","28.049301","10.0.1.1","10.0.1.2","ECHO","122","Request"
"15","28.049832","10.0.1.2","10.0.1.1","TCP","54","7  >  31036 [ACK] Seq=1 Ack=57 Win=2920 Len=0"
"16","28.053443","10.0.1.1","10.0.1.2","TCP","66","31036  >  7 [FIN, PSH, ACK] Seq=57 Ack=1 Win=2920 Len=0 TSval=1576231080 TSecr=0"
"17","28.053693","10.0.1.2","10.0.1.1","TCP","54","7  >  31036 [ACK] Seq=1 Ack=58 Win=2920 Len=0"
"18","28.053762","10.0.1.2","10.0.1.1","TCP","54","7  >  31036 [FIN, ACK] Seq=1 Ack=58 Win=2920 Len=0"
"19","28.058505","10.0.1.1","10.0.1.2","TCP","66","31036  >  7 [ACK] Seq=58 Ack=2 Win=2920 Len=0 TSval=1576231080 TSecr=0"
"20","29.059316","10.0.1.1","10.0.1.2","TCP","74","[TCP Port numbers reused] 31036  >  7 [SYN] Seq=0 Win=2920 Len=0 MSS=1460 TSval=1576231081 TSecr=0 WS=2"
"21","29.059861","10.0.1.2","10.0.1.1","TCP","54","7  >  31036 [SYN, ACK] Seq=0 Ack=1 Win=2920 Len=0"
"22","29.062082","10.0.1.1","10.0.1.2","TCP","66","31036  >  7 [ACK] Seq=1 Ack=1 Win=2920 Len=0 TSval=1576231081 TSecr=0"
"23","29.064233","10.0.1.1","10.0.1.2","ECHO","122","Request"
"24","29.064741","10.0.1.2","10.0.1.1","TCP","54","7  >  31036 [ACK] Seq=1 Ack=57 Win=2920 Len=0"
"25","29.069753","10.0.1.1","10.0.1.2","TCP","66","31036  >  7 [FIN, PSH, ACK] Seq=57 Ack=1 Win=2920 Len=0 TSval=1576231081 TSecr=0"
"26","29.073053","10.0.1.2","10.0.1.1","TCP","54","7  >  31036 [ACK] Seq=1 Ack=58 Win=2920 Len=0"
"27","29.073206","10.0.1.2","10.0.1.1","TCP","54","7  >  31036 [FIN, ACK] Seq=1 Ack=58 Win=2920 Len=0"
"28","29.076473","10.0.1.1","10.0.1.2","TCP","66","31036  >  7 [ACK] Seq=58 Ack=2 Win=2920 Len=0 TSval=1576231081 TSecr=0"
"29","33.374835","10.0.1.2","10.0.1.4","TCP","74","24589  >  7 [SYN] Seq=0 Win=2920 Len=0 MSS=1460 TSval=1576231085 TSecr=0 WS=2"
"30","33.375163","10.0.1.4","10.0.1.2","TCP","54","7  >  24589 [SYN, ACK] Seq=0 Ack=1 Win=2920 Len=0"
"31","33.376026","10.0.1.2","10.0.1.4","TCP","66","24589  >  7 [ACK] Seq=1 Ack=1 Win=2920 Len=0 TSval=1576231085 TSecr=0"
"32","33.376339","10.0.1.2","10.0.1.4","ECHO","122","Request"
"33","33.376678","10.0.1.4","10.0.1.2","TCP","54","7  >  24589 [ACK] Seq=1 Ack=57 Win=2920 Len=0"
"34","33.379557","10.0.1.2","10.0.1.4","TCP","66","24589  >  7 [FIN, PSH, ACK] Seq=57 Ack=1 Win=2920 Len=0 TSval=1576231085 TSecr=0"
"35","33.379931","10.0.1.4","10.0.1.2","TCP","54","7  >  24589 [ACK] Seq=1 Ack=58 Win=2920 Len=0"
"36","33.380018","10.0.1.4","10.0.1.2","TCP","54","7  >  24589 [FIN, ACK] Seq=1 Ack=58 Win=2920 Len=0"
"37","33.381991","10.0.1.2","10.0.1.4","TCP","66","24589  >  7 [ACK] Seq=58 Ack=2 Win=2920 Len=0 TSval=1576231085 TSecr=0"
"38","34.385565","10.0.1.2","10.0.1.4","TCP","74","[TCP Port numbers reused] 24589  >  7 [SYN] Seq=0 Win=2920 Len=0 MSS=1460 TSval=1576231086 TSecr=0 WS=2"
"39","34.392101","10.0.1.4","10.0.1.2","TCP","54","7  >  24589 [SYN, ACK] Seq=0 Ack=1 Win=2920 Len=0"
"40","34.468808","10.0.1.2","10.0.1.4","TCP","66","24589  >  7 [ACK] Seq=1 Ack=1 Win=2920 Len=0 TSval=1576231086 TSecr=0"
"41","34.477769","10.0.1.2","10.0.1.4","ECHO","122","Request"
"42","34.481984","10.0.1.4","10.0.1.2","TCP","54","7  >  24589 [ACK] Seq=1 Ack=57 Win=2920 Len=0"
"43","34.500582","10.0.1.2","10.0.1.4","TCP","66","24589  >  7 [FIN, PSH, ACK] Seq=57 Ack=1 Win=2920 Len=0 TSval=1576231086 TSecr=0"
"44","34.500937","10.0.1.4","10.0.1.2","TCP","54","7  >  24589 [ACK] Seq=1 Ack=58 Win=2920 Len=0"
"45","34.505476","10.0.1.4","10.0.1.2","TCP","54","7  >  24589 [FIN, ACK] Seq=1 Ack=58 Win=2920 Len=0"
"46","34.512419","10.0.1.2","10.0.1.4","TCP","66","24589  >  7 [ACK] Seq=58 Ack=2 Win=2920 Len=0 TSval=1576231086 TSecr=0"
